[
  {
    "version": "paired-source-manifest/1.0",
    "sample_id": "flynn-aldol-055",
    "source": {
      "source_url": "https://www.flynnresearchgroup.com/s/Problem-Set-6-Aldol-answers.docx",
      "citation": "Flynn Research Group. Organic Chemistry Assessments, CHM 2120, Problem Set 6: Aldol (answers). n.d. Accessed 13 September 2026.",
      "author_or_project": "Flynn Research Group",
      "retrieved_at": "2026-09-13T10:30:04.438664+00:00",
      "original_sha256": "de90d98615712b2ee69d9fb060955076cab92a1dacce255ac25a7638d66650f6",
      "asset_types": [
        "CDX",
        "EMF",
        "PNG",
        "DOCX"
      ],
      "redistributable": "unknown",
      "license": null,
      "license_evidence_url": "https://www.flynnresearchgroup.com/organic-assessments",
      "container": {
        "sha256": "3b63557df14651b3ddaf7f4756e29ec6c43a75c3e9870218da257f961b7eb0cd",
        "member": "word/embeddings/oleObject55.bin",
        "stream": "CONTENTS"
      }
    },
    "assets": [
      {
        "role": "original_target",
        "relative_locator": "source-survey-academic/extracted/flynn-org2-ps6-aldol-answers/oleObject55.cdx",
        "sha256": "de90d98615712b2ee69d9fb060955076cab92a1dacce255ac25a7638d66650f6",
        "bytes": 5690,
        "media_type": "chemical/x-cdx"
      },
      {
        "role": "source_container",
        "relative_locator": "source-survey-academic/flynn-org2-ps6-aldol-answers.docx",
        "sha256": "3b63557df14651b3ddaf7f4756e29ec6c43a75c3e9870218da257f961b7eb0cd",
        "bytes": 4549496,
        "media_type": "application/octet-stream"
      },
      {
        "role": "author_vector_preview",
        "relative_locator": "source-survey-academic/extracted/flynn-org2-ps6-aldol-answers/oleObject55.emf",
        "sha256": "780a49c8de9cda5dcd019f90af2a3457667a3a7e8f64b5d39681f93bc8851a0b",
        "bytes": 29200,
        "media_type": "image/emf"
      },
      {
        "role": "native_cdxml",
        "relative_locator": "native-target-55-attempt1/native.cdxml",
        "sha256": "bda51fbeec5a8348466de19c71d402cb0a207b8aca941547b2d1691e81ec13ce",
        "bytes": 16167,
        "media_type": "text/xml"
      },
      {
        "role": "native_cdx",
        "relative_locator": "native-target-55-attempt1/native.cdx",
        "sha256": "2aec591006d2e8e85e0e358ffdafdb0a1426dd9db8297258d0e06da2a79a6b6c",
        "bytes": 7216,
        "media_type": "chemical/x-cdx"
      },
      {
        "role": "native_reference_png",
        "relative_locator": "native-target-55-attempt1/native.png",
        "sha256": "9c501f09c5ca98389cb970038dab84306356667ca43197894cbaa097075ebf27",
        "bytes": 85697,
        "media_type": "image/png"
      },
      {
        "role": "native_viewing_jpeg",
        "relative_locator": "native-target-55-attempt1/native.jpeg",
        "sha256": "00fce43a126bd665c2c744a4f87e80c42292127068ab3fc39a51fc75f8816918",
        "bytes": 24562,
        "media_type": "image/jpeg"
      },
      {
        "role": "historical_same_process_cdx_reopen_readback",
        "relative_locator": "native-target-55-attempt1/cdx-readback.cdxml",
        "sha256": "b607686c4c291138f85c38f5d99becc318a6c3725386a2d0c334ac825a8bffc6",
        "bytes": 16173,
        "media_type": "text/xml"
      },
      {
        "role": "historical_same_process_cdxml_reopen_readback",
        "relative_locator": "native-target-55-attempt1/cdxml-readback.cdxml",
        "sha256": "58edc246a052afdd106a70f6a0258eb10762bf54f5c6f2c7f21fa8f3aa9cdf20",
        "bytes": 16446,
        "media_type": "text/xml"
      },
      {
        "role": "native_receipt",
        "relative_locator": "native-target-55-attempt1/events.jsonl",
        "sha256": "05d315e5459c37132d25aaf6af77717924d23d2ce460a9e3260478957811f6b2",
        "bytes": 38262,
        "media_type": "application/x-ndjson"
      },
      {
        "role": "cdx_fresh_process_readback",
        "relative_locator": "native-fresh-readbacks/flynn-aldol-055-cdx/readback.cdxml",
        "sha256": "72ea565bc8eb4061987c6c6428b782873cb9fb36793ef680b513f0ee2dd59166",
        "bytes": 16437,
        "media_type": "text/xml"
      },
      {
        "role": "cdx_fresh_process_receipt",
        "relative_locator": "native-fresh-readbacks/flynn-aldol-055-cdx/events.jsonl",
        "sha256": "d861b2a4d071fe06013e69827b8a190e6d84e4bd24a0f2d3cf9af32a819e5467",
        "bytes": 14153,
        "media_type": "application/x-ndjson"
      },
      {
        "role": "cdxml_fresh_process_readback",
        "relative_locator": "native-fresh-readbacks/flynn-aldol-055-cdxml/readback.cdxml",
        "sha256": "c84ead0751e07bdedc681fd1364238a50c77df78532a5d56335e6de3268002f9",
        "bytes": 16440,
        "media_type": "text/xml"
      },
      {
        "role": "cdxml_fresh_process_receipt",
        "relative_locator": "native-fresh-readbacks/flynn-aldol-055-cdxml/events.jsonl",
        "sha256": "4ba682d0247eafedff248957e4489927b63e8d564303edbd82d77327a33dcd6b",
        "bytes": 14215,
        "media_type": "application/x-ndjson"
      }
    ],
    "raw_asset_distribution": "private_only",
    "retrieval_notes": [
      "Public author-maintained download page; no explicit per-asset redistribution license found. Retained privately for authorized internal research.",
      "External topic and visual screening found no Beckmann/M2 relationship. Existing M2 and future holdouts were not read.",
      "Historical same-process readbacks preserve original hashes but do not prove disk reopening. Fresh per-format zero-document PID/HWND events and readbacks below supersede that claim; see verification/2026-09-13-paired-pilot/native-survey-checks.json. Native pairing does not imply lossless fidelity, editability, visual quality or human acceptance."
    ]
  },
  {
    "version": "paired-source-manifest/1.0",
    "sample_id": "flynn-aldol-032",
    "source": {
      "source_url": "https://www.flynnresearchgroup.com/s/Problem-Set-6-Aldol-answers.docx",
      "citation": "Flynn Research Group. Organic Chemistry Assessments, CHM 2120, Problem Set 6: Aldol (answers). n.d. Accessed 13 September 2026.",
      "author_or_project": "Flynn Research Group",
      "retrieved_at": "2026-09-13T10:30:04.438664+00:00",
      "original_sha256": "1ea45a87ece50bfdf606d11c2666a07ed46029994bdb6379243cb4bc01e6baa3",
      "asset_types": [
        "CDX",
        "EMF",
        "PNG",
        "DOCX"
      ],
      "redistributable": "unknown",
      "license": null,
      "license_evidence_url": "https://www.flynnresearchgroup.com/organic-assessments",
      "container": {
        "sha256": "3b63557df14651b3ddaf7f4756e29ec6c43a75c3e9870218da257f961b7eb0cd",
        "member": "word/embeddings/oleObject32.bin",
        "stream": "CONTENTS"
      }
    },
    "assets": [
      {
        "role": "original_target",
        "relative_locator": "source-survey-academic/extracted/flynn-org2-ps6-aldol-answers/oleObject32.cdx",
        "sha256": "1ea45a87ece50bfdf606d11c2666a07ed46029994bdb6379243cb4bc01e6baa3",
        "bytes": 6616,
        "media_type": "chemical/x-cdx"
      },
      {
        "role": "source_container",
        "relative_locator": "source-survey-academic/flynn-org2-ps6-aldol-answers.docx",
        "sha256": "3b63557df14651b3ddaf7f4756e29ec6c43a75c3e9870218da257f961b7eb0cd",
        "bytes": 4549496,
        "media_type": "application/octet-stream"
      },
      {
        "role": "author_vector_preview",
        "relative_locator": "source-survey-academic/extracted/flynn-org2-ps6-aldol-answers/oleObject32.emf",
        "sha256": "b41cf51c5dcf38aedd75cd7bbe74751f4cec829f37da7c875ecac5da0417aa77",
        "bytes": 29472,
        "media_type": "image/emf"
      },
      {
        "role": "native_cdxml",
        "relative_locator": "native-survey/flynn-aldol-032/native.cdxml",
        "sha256": "6e78330f65d63048dd2dd1ad713f9840342a9081e57ac0168d1b8e7d9b09a0d0",
        "bytes": 16866,
        "media_type": "text/xml"
      },
      {
        "role": "native_cdx",
        "relative_locator": "native-survey/flynn-aldol-032/native.cdx",
        "sha256": "b79054ae76e24df732e035cb898034d1c5c3c7d7bc3100706bd722f08ba89c4f",
        "bytes": 7696,
        "media_type": "chemical/x-cdx"
      },
      {
        "role": "native_reference_png",
        "relative_locator": "native-survey/flynn-aldol-032/native.png",
        "sha256": "912bdadc25f16da7202f00f308f8990ae1057467f756eeb75bb90e816a9d5833",
        "bytes": 75612,
        "media_type": "image/png"
      },
      {
        "role": "native_viewing_jpeg",
        "relative_locator": "native-survey/flynn-aldol-032/native.jpeg",
        "sha256": "5fbe6918a82862b041f2727b49eed05526b11a677bd131fd27b1a6f8ac3b0419",
        "bytes": 24988,
        "media_type": "image/jpeg"
      },
      {
        "role": "historical_same_process_cdx_reopen_readback",
        "relative_locator": "native-survey/flynn-aldol-032/cdx-readback.cdxml",
        "sha256": "fc5a6c80e02f360be58f5c807a2023324df61501cbbb54597ea35d975de609ce",
        "bytes": 16872,
        "media_type": "text/xml"
      },
      {
        "role": "historical_same_process_cdxml_reopen_readback",
        "relative_locator": "native-survey/flynn-aldol-032/cdxml-readback.cdxml",
        "sha256": "00898c386d9255c9befe496346948ec50bccd2ba505358742f539ebe2426a50a",
        "bytes": 16882,
        "media_type": "text/xml"
      },
      {
        "role": "native_receipt",
        "relative_locator": "native-survey/flynn-aldol-032/events.jsonl",
        "sha256": "c3ed59e654eee0ec14cb90616e16b7f44c874eed73b42904bbe21da209b76837",
        "bytes": 43526,
        "media_type": "application/x-ndjson"
      },
      {
        "role": "cdx_fresh_process_readback",
        "relative_locator": "native-fresh-readbacks/flynn-aldol-032-cdx/readback.cdxml",
        "sha256": "7be37a4268d81916100b078b9b955805e02e3e46ea9454157265c5311a48707c",
        "bytes": 16876,
        "media_type": "text/xml"
      },
      {